{
  "$schema": "https://json-schema.org/draft/2020-12/schema",
  "$id": "studio.schema.json",
  "title": "Studio",
  "description": "The top-level container for a creative AI studio. A studio defines agents, artifact types, stores, playbooks, quality criteria, and knowledge - everything needed to describe how creative work is done.",

  "type": "object",
  "required": ["id", "name", "agents"],

  "properties": {
    "id": {
      "$ref": "_definitions.schema.json#/$defs/id",
      "description": "Unique identifier for this studio"
    },

    "name": {
      "$ref": "_definitions.schema.json#/$defs/name",
      "description": "Human-readable name"
    },

    "description": {
      "$ref": "_definitions.schema.json#/$defs/markdown_text",
      "description": "Description of what this studio does and its creative domain"
    },

    "version": {
      "$ref": "_definitions.schema.json#/$defs/semver",
      "description": "Semantic version of this studio definition"
    },

    "constitution": {
      "$ref": "../governance/constitution.schema.json",
      "description": "Inviolable principles all agents must follow"
    },

    "agents": {
      "type": "array",
      "items": {
        "oneOf": [
          { "type": "string", "description": "File path to agent definition" },
          { "$ref": "agent.schema.json" }
        ]
      },
      "minItems": 1,
      "description": "Agents that can perform work in this studio. Can be inline objects or file paths (manifest pattern)."
    },

    "entry_agent": {
      "$ref": "_definitions.schema.json#/$defs/agent_ref",
      "description": "The agent that interfaces with external customers. Must reference an agent with is_entry_agent=true."
    },

    "entry_agents": {
      "type": "object",
      "additionalProperties": {
        "$ref": "_definitions.schema.json#/$defs/agent_ref"
      },
      "description": "Named entry points mapped to agent IDs (e.g., { 'authoring': 'showrunner', 'playtest': 'player_narrator' }). Alternative to single entry_agent when multiple contexts need different entry points."
    },

    "constitution_ref": {
      "type": "string",
      "description": "File path to constitution definition (manifest pattern alternative to inline constitution)"
    },

    "artifact_types": {
      "type": "array",
      "items": {
        "oneOf": [
          { "type": "string", "description": "File path to artifact type definition" },
          { "$ref": "artifact-type.schema.json" }
        ]
      },
      "default": [],
      "description": "Types of artifacts that can be created in this studio. Can be inline objects or file paths."
    },

    "asset_types": {
      "type": "array",
      "items": {
        "oneOf": [
          { "type": "string", "description": "File path to asset type definition" },
          { "$ref": "asset-type.schema.json" }
        ]
      },
      "default": [],
      "description": "Types of binary assets that can be stored in this studio. Can be inline objects or file paths."
    },

    "stores": {
      "type": "array",
      "items": {
        "oneOf": [
          { "type": "string", "description": "File path to store definition" },
          { "$ref": "store.schema.json" }
        ]
      },
      "default": [],
      "description": "Storage locations for artifacts and assets. Can be inline objects or file paths."
    },

    "playbooks": {
      "type": "array",
      "items": {
        "oneOf": [
          { "type": "string", "description": "File path to playbook definition" },
          { "$ref": "playbook.schema.json" }
        ]
      },
      "default": [],
      "description": "Playbooks defining how work flows through the studio. Can be inline objects or file paths."
    },

    "tools": {
      "type": "array",
      "items": {
        "oneOf": [
          { "type": "string", "description": "File path to tool definition" },
          { "$ref": "tool-definition.schema.json" }
        ]
      },
      "default": [],
      "description": "Tool definitions available to agents. Can be inline objects or file paths."
    },

    "quality_criteria": {
      "type": "array",
      "items": {
        "oneOf": [
          { "type": "string", "description": "File path to quality criteria definition" },
          { "$ref": "../governance/quality-criteria.schema.json" }
        ]
      },
      "default": [],
      "description": "Quality criteria used to validate work. Can be inline objects or file paths."
    },

    "relationships": {
      "type": "array",
      "items": {
        "oneOf": [
          { "type": "string", "description": "File path to relationship definition" },
          { "$ref": "relationship.schema.json" }
        ]
      },
      "default": [],
      "description": "Relationships between artifact types defining derivation chains and impact policies. Can be inline objects or file paths."
    },

    "knowledge": {
      "type": "array",
      "items": {
        "oneOf": [
          { "type": "string", "description": "File path to knowledge entry" },
          { "$ref": "../knowledge/knowledge-entry.schema.json" }
        ]
      },
      "default": [],
      "description": "Knowledge entries available to agents. Can be inline objects or file paths."
    },

    "knowledge_config": {
      "type": "string",
      "description": "File path to knowledge layer configuration (e.g., 'knowledge/layers.json')"
    },

    "model_class_config": {
      "$ref": "#/$defs/model_class_config",
      "description": "Configuration for model size classes, controlling prompt optimization and knowledge injection based on model capability"
    },

    "defaults": {
      "$ref": "#/$defs/studio_defaults",
      "description": "Default values and configurations"
    },

    "metadata": {
      "$ref": "#/$defs/studio_metadata",
      "description": "Additional metadata about the studio"
    }
  },

  "additionalProperties": false,

  "$defs": {
    "studio_defaults": {
      "type": "object",
      "description": "Default values for studio workflow behavior. Note: Flow control settings (mailbox sizes, backpressure thresholds) are runtime configuration, not domain knowledge - configure those in RuntimeConfig.",
      "properties": {
        "default_store": {
          "$ref": "_definitions.schema.json#/$defs/store_ref",
          "description": "Default store for artifacts without a specified store"
        },
        "default_playbook": {
          "$ref": "_definitions.schema.json#/$defs/playbook_ref",
          "description": "Default playbook when none specified"
        },
        "default_quality_criteria": {
          "type": "array",
          "items": { "type": "string" },
          "default": [],
          "description": "Quality criteria applied by default to all work"
        },
        "quality": {
          "$ref": "#/$defs/quality_settings",
          "description": "Quality workflow settings (design decisions, not runtime tuning)"
        }
      },
      "additionalProperties": false
    },

    "quality_settings": {
      "type": "object",
      "description": "Quality workflow design decisions.",
      "properties": {
        "max_rework_cycles": {
          "type": "integer",
          "minimum": 1,
          "default": 3,
          "description": "Maximum rework cycles before escalation"
        },
        "escalation_after_rework": {
          "type": "boolean",
          "default": true,
          "description": "Whether to escalate to human after max rework cycles exceeded"
        }
      },
      "additionalProperties": false
    },

    "studio_metadata": {
      "type": "object",
      "properties": {
        "domain": {
          "type": "string",
          "description": "Creative domain (e.g., 'interactive fiction', 'music production', 'game design')"
        },
        "authors": {
          "type": "array",
          "items": { "type": "string" },
          "description": "People who created this studio definition"
        },
        "created_at": {
          "type": "string",
          "format": "date-time"
        },
        "updated_at": {
          "type": "string",
          "format": "date-time"
        },
        "tags": {
          "type": "array",
          "items": { "type": "string" },
          "description": "Tags for categorization"
        },
        "license": {
          "type": "string",
          "description": "License for this studio definition"
        }
      },
      "additionalProperties": true
    },

    "model_class_config": {
      "type": "object",
      "description": "Configuration for model size classes. Used to optimize prompts based on model capability. Addresses 'Lost in the Middle' attention issues and token budget constraints in smaller models.",
      "properties": {
        "classes": {
          "type": "object",
          "properties": {
            "small": {
              "$ref": "#/$defs/model_class_definition",
              "description": "Small models (8B parameters and under)"
            },
            "medium": {
              "$ref": "#/$defs/model_class_definition",
              "description": "Medium models (8B-70B parameters)"
            },
            "large": {
              "$ref": "#/$defs/model_class_definition",
              "description": "Large models (70B+ parameters or frontier models)"
            }
          },
          "additionalProperties": false
        },
        "model_mappings": {
          "type": "object",
          "additionalProperties": {
            "type": "string",
            "enum": ["small", "medium", "large"]
          },
          "description": "Map specific model names to size classes. E.g., {'qwen3:8b': 'small', 'llama3.1:70b': 'medium', 'gpt-4o': 'large'}"
        }
      },
      "additionalProperties": false
    },

    "model_class_definition": {
      "type": "object",
      "description": "Settings for a specific model size class",
      "properties": {
        "max_params": {
          "type": "string",
          "description": "Maximum parameter count (e.g., '8B', '70B'). Null means no limit."
        },
        "prompt_budget_tokens": {
          "type": "integer",
          "minimum": 500,
          "description": "Target maximum tokens for system prompt. Smaller budget forces more aggressive optimization."
        },
        "use_concise_content": {
          "type": "boolean",
          "default": false,
          "description": "Whether to prefer concise_summary and concise_description over normal versions"
        },
        "use_sandwich_pattern": {
          "type": "boolean",
          "default": true,
          "description": "Whether to repeat critical instructions at end of prompt"
        }
      },
      "additionalProperties": false
    }
  }
}
